{
  "$schema": "https://json-schema.org/draft/2020-12/schema",
  "$id": "https://hs-kb.uythacnhapkhau.com/schemas/community-contribution.schema.json",
  "title": "Đóng góp dữ liệu cộng đồng — HS Knowledge Base",
  "description": "Định dạng chuẩn để cộng đồng gửi dữ liệu vào kho tri thức HS. Mỗi tệp trong data/community/ phải khớp schema này. KHÔNG được chứa thông tin khách hàng: tên doanh nghiệp, MST, số tờ khai, trị giá, đối tác, liên hệ.",
  "type": "object",
  "required": ["kind", "contributor", "license", "records"],
  "additionalProperties": false,
  "properties": {
    "kind": {
      "type": "string",
      "enum": ["precedent", "correction", "conflict-table", "product-example"],
      "description": "precedent = thông báo phân loại TB-TCHQ · correction = báo lỗi dữ liệu hiện có · conflict-table = bảng phân giải cụm mã dễ nhầm · product-example = tên sản phẩm ví dụ cho mã Loại khác"
    },
    "contributor": {
      "type": "object",
      "required": ["name"],
      "additionalProperties": false,
      "properties": {
        "name": { "type": "string", "minLength": 2, "maxLength": 100, "description": "Tên hoặc nick để ghi công. Không bắt buộc là tên thật." },
        "github": { "type": "string", "pattern": "^[A-Za-z0-9-]{1,39}$" },
        "organization": { "type": "string", "maxLength": 100, "description": "Tuỳ chọn. Tổ chức của CHÍNH BẠN, không phải của khách hàng bạn." }
      }
    },
    "license": {
      "type": "string",
      "const": "CC-BY-SA-4.0",
      "description": "Xác nhận bạn có quyền chia sẻ dữ liệu này và đồng ý cấp phép theo CC BY-SA 4.0."
    },
    "submittedAt": { "type": "string", "format": "date" },
    "note": { "type": "string", "maxLength": 2000 },
    "records": {
      "type": "array",
      "minItems": 1,
      "maxItems": 500,
      "items": { "$ref": "#/$defs/record" }
    }
  },
  "$defs": {
    "hsCode": {
      "type": "string",
      "pattern": "^[0-9]{4}([0-9]{2}([0-9]{2})?)?$",
      "description": "Mã HS 4, 6 hoặc 8 chữ số"
    },
    "record": {
      "type": "object",
      "required": ["hsCode", "description", "source"],
      "additionalProperties": false,
      "properties": {
        "hsCode": { "$ref": "#/$defs/hsCode" },
        "description": {
          "type": "string",
          "minLength": 5,
          "maxLength": 500,
          "description": "Mô tả hàng hoá. CHỈ đặc điểm hàng: tên, vật liệu, công dụng, thông số. KHÔNG tên doanh nghiệp, KHÔNG trị giá, KHÔNG số tờ khai."
        },
        "source": {
          "type": "object",
          "required": ["type"],
          "additionalProperties": false,
          "description": "Căn cứ của dữ liệu — đây là thứ quyết định độ tin cậy. Không có nguồn thì không nhận.",
          "properties": {
            "type": {
              "type": "string",
              "enum": ["TB-TCHQ", "van-ban-phap-luat", "to-khai-da-thong-quan", "chu-giai-WCO", "kinh-nghiem-thuc-te"],
              "description": "to-khai-da-thong-quan = tờ khai của bạn đã thông quan (chỉ nộp cặp mô tả↔mã, không kèm chứng từ)"
            },
            "reference": { "type": "string", "maxLength": 200, "description": "Số hiệu văn bản, vd '1234/TB-TCHQ'" },
            "issuedDate": { "type": "string", "format": "date" },
            "url": { "type": "string", "format": "uri", "maxLength": 500 },
            "clearedYear": { "type": "integer", "minimum": 2015, "maximum": 2100, "description": "Năm thông quan — chỉ NĂM, không ngày cụ thể (tránh truy ngược lô hàng)" }
          }
        },
        "attributes": {
          "type": "object",
          "description": "Thuộc tính phân loại theo data/attributes.json — vd chatLieu, congSuat, dienAp",
          "additionalProperties": { "type": ["string", "number", "boolean"] }
        },
        "evidence": {
          "type": "object",
          "additionalProperties": false,
          "description": "Bằng chứng đọc đúng văn bản (bắt buộc với tiền lệ TB-TCHQ nộp từ 2026-10-06): dòng số hiệu và câu kết luận chép nguyên văn từ chính trang đã mở",
          "properties": {
            "soHieu": { "type": "string", "maxLength": 100, "description": "Dòng 'Số: …' ở đầu văn bản, vd '1234/TB-TCHQ'" },
            "ketLuan": { "type": "string", "maxLength": 1000, "description": "Câu kết luận nguyên văn có mã số, vd 'thuộc nhóm 39.26 … mã số 3926.90.99 …'" }
          }
        },
        "girRule": { "type": "string", "pattern": "^GIR ?[1-6]( ?\\([abc]\\))?$", "description": "Quy tắc GIR làm căn cứ, nếu biết" },
        "reasonVi": { "type": "string", "maxLength": 1000, "description": "Vì sao phân loại như vậy — phần quý nhất của đóng góp" },
        "confusedWith": {
          "type": "array",
          "maxItems": 10,
          "items": { "$ref": "#/$defs/hsCode" },
          "description": "Các mã hay bị nhầm với mã này"
        },
        "correctionOf": {
          "type": "object",
          "description": "Chỉ dùng khi kind=correction — chỉ ra dữ liệu nào đang sai",
          "additionalProperties": false,
          "required": ["file", "currentValue"],
          "properties": {
            "file": { "type": "string", "maxLength": 200, "description": "vd data/tax.json" },
            "field": { "type": "string", "maxLength": 100 },
            "currentValue": { "type": "string", "maxLength": 500 },
            "proposedValue": { "type": "string", "maxLength": 500 }
          }
        }
      }
    }
  }
}
