{
  "kind": "precedent",
  "contributor": {
    "name": "hermes-tracuuhs",
    "github": "ozvietnam"
  },
  "license": "CC-BY-SA-4.0",
  "submittedAt": "2026-10-13T18:07:07Z",
  "note": "Lô tracuuhs.com — 20 TB-TCHQ mở chi tiết (mã 8 số + lý do nguyên văn + evidence), đóng gói từ data/customs/processed/tracuuhs-detail-2026-10-13-goi-058.json bằng tools/dong-goi-lo-tb-tchq.mjs (oz-wiki-plhq). Bản 20/20 đạt luật validate-community của kể từ 06/10.",
  "records": [
    {
      "hsCode": "38249999",
      "description": "Thông báo 2345/TB-TCHQ 2018 kết quả xác định trước mã số đối với Bột Cobalt Lithium | HSTC - Thành phần cấu tạo: LiCoO2. Cơ chế hoạt động, cách thức sử dụng: sử dụng để sản xuất bột kim loại. Hàm lượng tính trên trọng lượng: Hàm lượng Co giao động từ 13% đến 16%.",
      "source": {
        "type": "TB-TCHQ",
        "reference": "2345/TB-TCHQ",
        "issuedDate": "2018-05-02",
        "url": "https://www.tracuuhs.com/tin-tuc/tchq-2345-2018"
      },
      "attributes": {
        "bieuThue": "2017",
        "loaiTB": "XAC_DINH_TRUOC"
      },
      "reasonVi": "thuộc nhóm 38.24 “Chất gắn đã điều chế dùng cho các loại khuôn đúc hoặc lõi đúc; các sản phẩm và chế phẩm hóa học của ngành công nghiệp hóa chất hoặc các ngành công nghiệp có liên quan (kể cả các sản phẩm và chế phẩm chứa hỗn hợp các sản phẩm tự nhiên), chưa được chi tiết hoặc ghi ở nơi khác”, phân nhóm “- Loại khác ”, phân nhóm 3824.99 “- - Loại khác”, phân nhóm “- - - Loại khác”, mã số 3824.99.99 “- - - - Loại khác”, tại Danh mục hàng hóa xuất khẩu, nhập khẩu Việt Nam.",
      "evidence": {
        "soHieu": "2345/TB-TCHQ",
        "ketLuan": "99 “- - Loại khác”, phân nhóm “- - - Loại khác”, mã số 3824.99.99 “- - - - Loại khác”, tại Danh mục hàng hóa xuất khẩu, nhập khẩu Việt Nam"
      }
    },
    {
      "hsCode": "38249970",
      "description": "Thông báo 2614/TB-TCHQ 2023 kết quả xác định trước mã số đối với Sub4salt F3000 | HSTC",
      "source": {
        "type": "TB-TCHQ",
        "reference": "2614/TB-TCHQ",
        "issuedDate": "2023-05-29",
        "url": "https://www.tracuuhs.com/tin-tuc/tchq-2614-2023"
      },
      "attributes": {
        "bieuThue": "2022",
        "loaiTB": "XAC_DINH_TRUOC"
      },
      "reasonVi": "thuộc nhóm 38.24 “Chất gắn đã điều chế dùng cho các loại khuôn đúc hoặc lõi đúc; các sản phẩm và chế phẩm hóa học của ngành công nghiệp hóa chất hoặc các ngành công nghiệp có liên quan (kể cả các sản phẩm và chế phẩm chứa hỗn hợp các sản phẩm tự nhiên), chưa được chi tiết hoặc ghi ở nơi khác.”, phân nhóm “- Loại khác:”, phân nhóm 3824.99 “- - Loại khác:”, mã số 3824.99.70 “- - - Các chế phẩm hóa chất khác, dùng trong chế biến thực phẩm” tại Danh mục hàng hóa xuất khẩu, nhập khẩu Việt Nam",
      "evidence": {
        "soHieu": "2614/TB-TCHQ",
        "ketLuan": "thuộc nhóm 38.24 “Chất gắn đã điều chế dùng cho các loại khuôn đúc hoặc lõi đúc; các sản phẩm và chế phẩm hóa học của ngành công nghiệp hóa chất hoặc các ngành công nghiệp có liên quan (kể cả các sản phẩm và chế phẩm chứa hỗn hợp các sản phẩm tự nhiên), chưa được chi tiết hoặc ghi ở nơi khác.”, phân nhóm “- Loại khác:”, phân nhóm 3824.99 “- - Loại khác:”, mã số 3824.99.70 “- - - Các chế phẩm hóa chất khác, dùng trong chế biến thực phẩm” tại Danh mục hàng hóa xuất khẩu, nhập khẩu Việt Nam"
      }
    }
  ]
}
