{
  "kind": "precedent",
  "contributor": { "name": "Nguyễn Văn A", "github": "example-user" },
  "license": "CC-BY-SA-4.0",
  "submittedAt": "2026-09-07",
  "note": "Ví dụ mẫu để người đóng góp copy. Xoá tệp này khi gửi đóng góp thật.",
  "records": [
    {
      "hsCode": "84137042",
      "description": "Máy bơm nước ly tâm dân dụng, công suất 1HP, đầu bơm bằng gang, điện 220V, hàng mới 100%",
      "source": { "type": "TB-TCHQ", "reference": "1234/TB-TCHQ", "issuedDate": "2025-03-15" },
      "attributes": { "congSuat": "1HP", "chatLieu": "gang", "dienAp": "220V" },
      "girRule": "GIR 1",
      "reasonVi": "Bơm ly tâm dùng nước sạch, không phải bơm nhiên liệu (8413.30) cũng không phải bơm bê tông (8413.40).",
      "confusedWith": ["84133090", "84134000"]
    }
  ]
}
