{
  "kind": "precedent",
  "contributor": {
    "name": "hermes-tracuuhs",
    "github": "ozvietnam"
  },
  "license": "CC-BY-SA-4.0",
  "submittedAt": "2026-10-13T18:17:57Z",
  "note": "Lô tracuuhs.com — 18 TB-TCHQ mở chi tiết (mã 8 số + lý do nguyên văn + evidence), đóng gói từ data/customs/processed/tracuuhs-detail-2026-10-14-goi-068.json bằng tools/dong-goi-lo-tb-tchq.mjs (oz-wiki-plhq). Bản 18/19 đạt luật validate-community của kể từ 06/10.",
  "records": [
    {
      "hsCode": "44014000",
      "description": "Hoá phẩm khoan dầu khí: MIL-PLUG COARSE thành phần chính: (Cellulose) Công dụng chống mất dung dịch khoan - Mặt hàng là vỏ quả hạch đã được nghiền thô, được khai báo dùng chống mất dung dịch khoan dầu khí",
      "source": {
        "type": "TB-TCHQ",
        "reference": "7421/TB-TCHQ",
        "issuedDate": "2018-12-18",
        "url": "https://www.tracuuhs.com/tin-tuc/tchq-7421-2018"
      },
      "attributes": {
        "bieuThue": "2017",
        "loaiTB": "KET_QUA_PHAN_LOAI"
      },
      "reasonVi": "Mặt hàng là vỏ quả hạch đã được nghiền thô, được khai báo dùng chống mất dung dịch khoan dầu khí thuộc nhóm 44.01 “Gỗ nhiên liệu, dạng khúc, thanh nhỏ, cành, bó hoặc các dạng tương tự; vỏ bào hoặc dăm gỗ; mùn cưa và phế liệu gỗ, đã hoặc chưa đóng thành khối, bánh (briquettes), viên hoặc các dạng tương tự”; mã số 4401.40.00 - Mùn cưa và phế liệu gỗ, chưa đóng thành khối tại Danh mục hàng hóa xuất khẩu, nhập khẩu Việt Nam./.",
      "evidence": {
        "soHieu": "7421/TB-TCHQ",
        "ketLuan": "Mặt hàng là vỏ quả hạch đã được nghiền thô, được khai báo dùng chống mất dung dịch khoan dầu khí thuộc nhóm 44.01 “Gỗ nhiên liệu, dạng khúc, thanh nhỏ, cành, bó hoặc các dạng tương tự; vỏ bào hoặc dăm gỗ; mùn cưa và phế liệu gỗ, đã hoặc chưa đóng thành khối, bánh (briquettes), viên hoặc các dạng tương tự”; mã số 4401.40.00 - Mùn cưa và phế liệu gỗ, chưa đóng thành khối tại Danh mục hàng hóa xuất khẩu, nhập khẩu Việt Nam./."
      }
    }
  ]
}