{
  "kind": "precedent",
  "contributor": {
    "name": "hermes-tracuuhs",
    "github": "ozvietnam"
  },
  "license": "CC-BY-SA-4.0",
  "submittedAt": "2026-10-13T18:25:50Z",
  "note": "Lô tracuuhs.com — 17 TB-TCHQ mở chi tiết (mã 8 số + lý do nguyên văn + evidence), đóng gói từ data/customs/processed/tracuuhs-detail-2026-10-14-goi-071.json bằng tools/dong-goi-lo-tb-tchq.mjs (oz-wiki-plhq). Bản 17/20 đạt luật validate-community của kể từ 06/10.",
  "records": [
    {
      "hsCode": "52104100",
      "description": ". Vải 65% poly, 35% cotton, mã hàng: BN-S10, khổ: 58 inch, hàng mới 100%. - Vải dệt thoi, kiểu dệt vân điểm, đi từ các sợi có màu khác nhau, thành phần xơ staple polyeste 43%, xơ bông 57%, bề mặt vải không thấm tẩm, tráng, phủ hoặc ép lớp, dạng cuộn, trọng lượng 128g/m2, khổ 150cm.",
      "source": {
        "type": "TB-TCHQ",
        "reference": "516/TB-TCHQ",
        "issuedDate": "2018-01-26",
        "url": "https://www.tracuuhs.com/tin-tuc/tchq-516-2018"
      },
      "attributes": {
        "bieuThue": "2017",
        "loaiTB": "KET_QUA_PHAN_LOAI",
        "legacyHs": true,
        "legacyHsNote": "Mã 2017 không có trong tax.json EN2022. TB-TCHQ 516/TB-TCHQ gốc ghi mã này."
      },
      "reasonVi": "Tên gọi theo cấu tạo, công dụng: Vải dệt thoi, kiểu dệt vân điểm, đi từ các sợi có màu khác nhau, thành phần xơ staple polyeste 43%, xơ bông 57%, bề mặt vải không thấm tẩm, tráng, phủ hoặc ép lớp, dạng cuộn, trọng lượng 128g/m2, khổ 150cm. thuộc nhóm 52.10 “Vải dệt thoi từ bông, có tỷ trọng bông dưới 85%, pha chủ yếu hoặc pha duy nhất với xơ sợi nhân tạo, có trọng lượng không quá 200 g/m2”, phân nhóm “- Từ các sợi có màu khác nhau”, mã số 5210.41.00 “- - Vải vân điểm” tại Danh mục hàng hóa xuất khẩu, nhập khẩu Việt Nam.",
      "evidence": {
        "soHieu": "516/TB-TCHQ",
        "ketLuan": "Tên gọi theo cấu tạo, công dụng: Vải dệt thoi, kiểu dệt vân điểm, đi từ các sợi có màu khác nhau, thành phần xơ staple polyeste 43%, xơ bông 57%, bề mặt vải không thấm tẩm, tráng, phủ hoặc ép lớp, dạng cuộn, trọng lượng 128g/m2, khổ 150cm. thuộc nhóm 52.10 “Vải dệt thoi từ bông, có tỷ trọng bông dưới 85%, pha chủ yếu hoặc pha duy nhất với xơ sợi nhân tạo, có trọng lượng không quá 200 g/m2”, phân nhóm “- Từ các sợi có màu khác nhau”, mã số 5210.41.00 “- - Vải vân điểm” tại Danh mục hàng hóa xuất khẩu, nhập khẩu Việt Nam."
      }
    },
    {
      "hsCode": "54076990",
      "description": "Vải dệt thoi; dệt từ các sợi đơn, độ bền tương đối của sợi < 60 cN/tex; thành phần gồm 81,4% filament polyester không dún, 15,4% filament polyester dún và 3,2% sợi đàn hồi Polyurethan, đã in, chưa ngâm tẩm hay tráng phủ bề mặt, trọng lượng 104,5g/m2, dạng cuộn, khổ lớn hơn 1m.",
      "source": {
        "type": "TB-TCHQ",
        "reference": "2714/TB-TCHQ",
        "issuedDate": "2018-05-17",
        "url": "https://www.tracuuhs.com/tin-tuc/tchq-2714-2018"
      },
      "attributes": {
        "bieuThue": "2017",
        "loaiTB": "KET_QUA_PHAN_LOAI"
      },
      "reasonVi": "Tên gọi theo cấu tạo, công dụng: Vải dệt thoi; dệt từ các sợi đơn, độ bền tương đối của sợi < 60cN/tex; thành phần gồm 81,4% filament polyester không dún, 15,4% filament polyester dún và 3,2% sợi đàn hồi Polyurethan, đã in, chưa ngâm tẩm hay tráng phủ bề mặt, trọng lượng 104,5g/m2, dạng cuộn, khổ lớn hơn 1m. thuộc nhóm 54.07 “Vải dệt thoi bằng sợi filament tổng hợp, kể cả vải dệt thoi thu được từ các nguyên liệu thuộc nhóm 54.04”, phân nhóm “- Vải dệt thoi khác, có tỷ trọng sợi filament polyeste từ 85% trở lên:” phân nhóm 5407.69 “- - Loại khác:”, mã số 5407.69.90 “- - - Loại khác” tại Danh mục hàng hóa xuất khẩu, nhập khẩu Việt Nam.",
      "evidence": {
        "soHieu": "2714/TB-TCHQ",
        "ketLuan": "Tên gọi theo cấu tạo, công dụng: Vải dệt thoi; dệt từ các sợi đơn, độ bền tương đối của sợi < 60cN/tex; thành phần gồm 81,4% filament polyester không dún, 15,4% filament polyester dún và 3,2% sợi đàn hồi Polyurethan, đã in, chưa ngâm tẩm hay tráng phủ bề mặt, trọng lượng 104,5g/m2, dạng cuộn, khổ lớn hơn 1m. thuộc nhóm 54.07 “Vải dệt thoi bằng sợi filament tổng hợp, kể cả vải dệt thoi thu được từ các nguyên liệu thuộc nhóm 54.04”, phân nhóm “- Vải dệt thoi khác, có tỷ trọng sợi filament polyeste từ 85% trở lên:” phân nhóm 5407.69 “- - Loại khác:”, mã số 5407.69.90 “- - - Loại khác” tại Danh mục hàng hóa xuất khẩu, nhập khẩu Việt Nam."
      }
    }
  ]
}